{
  "$schema": "https://json-schema.org/draft/2020-12/schema",
  "$id": "https://github.com/ia-mm-ai/PRESENCE/SYSTEM/AVALANCHE/AVALANCHE_IMPLEMENTATION_001/vm/genesis/genesis.schema.json",
  "title": "PRESENCE Avalanche genesis or unmaterialized genesis template",
  "description": "Structural contract only. Materialized genesis must also pass presence-avalanche-vm --check-genesis, including uint bounds, UTF-8 byte limits and capacity inequalities. A valid blank template is not a formed deployment.",
  "type": "object",
  "additionalProperties": false,
  "required": ["format", "version", "encoding", "domain", "lineage", "constitution", "locality", "profile", "capacity", "continuity", "initial_state", "claim_limits", "evolution"],
  "properties": {
    "format": {"const": "PRESENCE_AVALANCHE_RUNTIME_GENESIS_001"},
    "version": {"const": 1},
    "encoding": {"const": "UTF-8_JSON"},
    "domain": {
      "type": "object",
      "additionalProperties": false,
      "required": ["id", "genesis_id", "vm_class", "execution_model", "state_model", "purpose"],
      "properties": {
        "id": {"const": "PRESENCE_AVALANCHE_VM_001"},
        "genesis_id": {"type": "string"},
        "vm_class": {"const": "AVALANCHE_CUSTOM_RPCCHAINVM"},
        "execution_model": {"const": "NON_EVM_SIGNED_EVENT_SOURCED"},
        "state_model": {"const": "VERSIONED_EVENT_SOURCED_LIVING_CAPACITY"},
        "purpose": {"type": "string"}
      }
    },
    "lineage": {
      "const": {
        "direct_predecessor": {
          "protocol": "LOCALITY_VM_003",
          "version": "3.0.0",
          "vm_id": "25tZjky6SecZA1Gwc6VwD2ouy64xAUdgNLo1C8dkXfbsFNxaTk",
          "repository_pack_sha256": "5597eab61802b1df92636b6df88fea46b88f460c4e5f2c51e393c5c6ce7a214f",
          "repository_checksum_sidecar_sha256": "abab31f2dd1018831034bc93e67eb7e125352e1fb71142e8ed6e5bafa4235e69",
          "linux_release_sha256": "205d6823e520884c59fb09f06091362370c29891661e54af7aff0f313c6bbb65",
          "qualification_evidence_sha256": "170eafe5836ee5d43bd0def635c048a29d9b30937e596a4336378695500aac64",
          "disposition": "PRESERVED_IMMUTABLE_PREDECESSOR"
        },
        "formation_ancestor": {
          "name": "KENTRA",
          "blockchain_id": "LB6wwV4JNxr8fwjUPBHMzf3PiW2d4hsTc4v63uX1MjY6oZ9Wb",
          "l1_id": "21mJfY4QpDeVykBaeG8nwn7k7w7b5oPpPhaYcJWqumht8SvaK",
          "vm_id": "pJHx1NU8ghWsiwg1vrqwaqE5uKh1k4EJRBkpB1tKV1QuQFhMi",
          "validation_id": "ttR2sBgWUEq3e6dupCxYcyiGTv49wnYW3wZ6TUs7XnDkTeZjh",
          "validator_node_id": "NodeID-AD66psMnQ257UAF7Jz9FmNAyRdibVnkt",
          "genesis_id": "KENTRA-CUSTOM-VM-GENESIS-001",
          "body_sha256": "58bf3daa9c74aac496451179f053152ed50943b8e8c4dbdac8f34d7172ab4f72",
          "disposition": "FORMATION_COMPLETE_REFERENCE_ONLY",
          "credential_custody": "UNAVAILABLE_TO_CURRENT_OPERATOR",
          "continuation_requirement": "NEW_LOCALITY_REQUIRES_NEW_VALIDATOR_AND_AUTHORITY_CUSTODY"
        },
        "relation": "SUCCESSOR_DERIVED_WITHOUT_REWRITE",
        "effect": "ANCESTRY_REFERENCE_ONLY",
        "authority_transfer": "NONE",
        "shared_currentness": "NONE"
      }
    },
    "constitution": {
      "const": {
        "human_path": "SOURCE/CONSTITUTION_0()1.md",
        "human_sha256": "affeb5738cdfeea7ee4fe985652bf78b15eb6dfbba5871d82f0f2213a81832d0",
        "machine_path": "SOURCE/CONSTITUTION_0()1.json",
        "machine_sha256": "519a81d2a26d5bf32afd77566bbb35b4d28b22af85ac45a7055fccd1b45222f8",
        "form_binding_path": "SYSTEM/AVALANCHE/AVALANCHE_IMPLEMENTATION_001/bindings/SOURCE_STATE_BINDING_001.json",
        "form_binding_sha256": "8d96c1e24262164636c8068292ccef0d20029488568cc805b6097e3430eb9842",
        "form_binding_bytes": 1456,
        "public_origin": {
          "repository": "https://github.com/ia-mm-ai/PRESENCE",
          "commit": "5e09d1fbe3c1008937d95497fcc162a6ebd4190d",
          "human_repository_path": "SOURCE/CONSTITUTION_0()1.md",
          "machine_repository_path": "SOURCE/CONSTITUTION_0()1.json",
          "human_bytes": 44133,
          "machine_bytes": 146048,
          "binding": "SOURCE_AT_STARTING_COMMIT_WITH_SUCCESSOR_LOCAL_STATE_BINDING",
          "mirror_effect": "NO_BUNDLED_SOURCE_MIRROR",
          "publication_effect": "PUBLICATION_NOT_FORMATION"
        },
        "human_role": "SUBSTANTIVE_MEANING",
        "machine_role": "REPRESENTATION_ONLY",
        "conflict_result": "UNRESOLVED_HOLD_EXACT_SCOPE",
        "parsing_has_force": false
      }
    },
    "locality": {
      "type": "object",
      "additionalProperties": false,
      "required": ["id", "source_reference", "source_sha256", "formation_authority"],
      "properties": {
        "id": {"type": "string"},
        "source_reference": {"type": "string"},
        "source_sha256": {"type": "string"},
        "formation_authority": {
          "type": "object",
          "additionalProperties": false,
          "required": ["scheme", "key_id", "public_key", "scope"],
          "properties": {
            "scheme": {"const": "ED25519"},
            "key_id": {"type": "string"},
            "public_key": {"type": "string"},
            "scope": {"const": "FORMATION_AND_BOOTSTRAP_ONLY"}
          }
        }
      }
    },
    "profile": {"$ref": "#/$defs/profile"},
    "capacity": {
      "type": "object",
      "additionalProperties": false,
      "required": ["unit", "structural_ceiling_units", "initial_actual_units", "correction_egress_reserve_units", "max_admission_offer_seconds", "availability_rule", "reservation_rule", "degradation_rule"],
      "properties": {
        "unit": {"const": "PRESENCE_AVALANCHE_CAPACITY_UNIT"},
        "structural_ceiling_units": {"$ref": "#/$defs/positiveUint64"},
        "initial_actual_units": {"type": "integer", "minimum": 0, "maximum": 18446744073709551615},
        "correction_egress_reserve_units": {"$ref": "#/$defs/positiveUint64"},
        "max_admission_offer_seconds": {"type": "integer", "minimum": 1, "maximum": 9223372036854775807},
        "availability_rule": {"const": "C_AVAILABLE_EQUALS_C_ACTUAL_MINUS_C_UNRESOLVED_MINUS_C_CORRECTION_EGRESS"},
        "reservation_rule": {"const": "ENTER_RESERVES_WORK_AND_LAWFUL_RESOLUTION_ATOMICALLY"},
        "degradation_rule": {"const": "INSUFFICIENT_ACTUAL_CAPACITY_FORCES_HOLD_WITH_CORRECTION_AND_EGRESS_OPEN"}
      }
    },
    "continuity": {
      "type": "object",
      "additionalProperties": false,
      "required": ["initial_posture", "minimum_continuity_authorities", "successor_attestation_threshold", "formation_authority_lifecycle", "p_zero_rule", "pulse_rule", "infrastructure_succession_rule"],
      "properties": {
        "initial_posture": {"const": "DORMANT_P0"},
        "minimum_continuity_authorities": {"type": "integer", "minimum": 2, "maximum": 4294967295},
        "successor_attestation_threshold": {"type": "integer", "minimum": 2, "maximum": 4294967295},
        "formation_authority_lifecycle": {"const": "EXPLICITLY_EXHAUSTIBLE_AFTER_CONTINUITY_SEEDING"},
        "p_zero_rule": {"const": "CHECKPOINT_DORMANT_NO_FABRICATED_ACTIVITY_REENTRY_OPEN"},
        "pulse_rule": {"const": "SIGNED_CURRENTNESS_OBSERVATION_NOT_AUTONOMOUS_AUTHORITY"},
        "infrastructure_succession_rule": {"const": "INFRASTRUCTURE_CANNOT_SELF_APPOINT_SUCCESSOR"}
      }
    },
    "initial_state": {"const": {"revision": 0, "previous_state_commitment": null, "history": "APPEND_ONLY"}},
    "claim_limits": {
      "const": {
        "external_truth": "NOT_INFERRED",
        "receipt": "HISTORICAL_EVIDENCE_NOT_CURRENT_PRESENCE",
        "acceptance": "NOT_INFERRED",
        "consent": "NOT_INFERRED",
        "relation": "NOT_CREATED_BY_GENESIS",
        "crossing": "NOT_CREATED_BY_GENESIS",
        "capacity": "SIGNED_LOCAL_ACCOUNT_NOT_EXTERNAL_RESOURCE_PROOF",
        "pulse": "SIGNED_LOCAL_CURRENTNESS_NOT_EXTERNAL_LIVENESS_PROOF",
        "state_succession": "DETERMINISTIC_COMMITMENT_LINEAGE_NOT_SEMANTIC_TRUTH_OR_CONSCIOUSNESS_PROOF",
        "unknown": "REMAINS_UNKNOWN"
      }
    },
    "evolution": {
      "const": {
        "state_schema_version": 1,
        "unknown_fields": "REJECT",
        "genesis_mutability": "IMMUTABLE",
        "upgrade_policy": "ATTESTED_SUCCESSOR_FREEZE_AND_EXTERNAL_BINARY_HANDOFF",
        "activation_effect": "FREEZES_PREDECESSOR_STATE_WITHOUT_EXECUTING_UNKNOWN_SUCCESSOR_CODE"
      }
    }
  },
  "oneOf": [
    {
      "title": "Unmaterialized template",
      "properties": {
        "domain": {"properties": {"genesis_id": {"const": ""}, "purpose": {"const": ""}}},
        "locality": {
          "properties": {
            "id": {"const": ""},
            "source_reference": {"const": ""},
            "source_sha256": {"const": ""},
            "formation_authority": {
              "properties": {
                "key_id": {"const": "MATERIALIZE-WITH-PRESENCE-AVALANCHE-VM"},
                "public_key": {"const": ""}
              }
            }
          }
        }
      }
    },
    {
      "title": "Materialized deployment",
      "properties": {
        "domain": {
          "properties": {
            "genesis_id": {"$ref": "#/$defs/safeID"},
            "purpose": {"type": "string", "minLength": 1, "maxLength": 1024, "not": {"pattern": "[\\u0000-\\u001f\\u007f-\\u009f]"}}
          }
        },
        "locality": {
          "properties": {
            "id": {"$ref": "#/$defs/safeID"},
            "source_reference": {"$ref": "#/$defs/safeID"},
            "source_sha256": {"$ref": "#/$defs/hex32"},
            "formation_authority": {
              "properties": {
                "key_id": {"$ref": "#/$defs/safeID"},
                "public_key": {"$ref": "#/$defs/hex32"}
              }
            }
          }
        }
      }
    }
  ],
  "$defs": {
    "safeID": {"type": "string", "minLength": 1, "maxLength": 128, "pattern": "^[A-Za-z0-9][A-Za-z0-9._:-]{0,127}$", "not": {"pattern": "[^A-Za-z0-9._:-]"}},
    "hex32": {"type": "string", "minLength": 64, "maxLength": 64, "pattern": "^[0-9a-f]{64}$"},
    "positiveUint64": {"type": "integer", "minimum": 1, "maximum": 18446744073709551615},
    "profile": {
      "type": "object",
      "additionalProperties": false,
      "required": ["form_id", "form_sha256", "gate_postures", "effect_ceiling", "non_collapse_rules", "private_state", "admission_rule", "entry_rule", "capacity_rule", "correction_rule", "presence_rule", "dormancy_rule", "reentry_rule", "succession_rule", "origin_rule"],
      "properties": {
        "form_id": {"const": "PRESENCE-AVALANCHE-FORM-001"},
        "form_sha256": {"const": "e70fedb8ec8420275703542ee16d6d0429b1b5979b0b8ff964eac87aa19a7d8a"},
        "gate_postures": {
          "type": "array", "uniqueItems": true, "minItems": 4, "maxItems": 4,
          "items": {"enum": ["ADMIT", "REFUSE", "WITHHOLD", "HOLD"]}
        },
        "effect_ceiling": {
          "type": "array", "uniqueItems": true, "minItems": 12, "maxItems": 12,
          "items": {
            "enum": [
              "NO_FORMATION_BY_CONFORMANCE", "NO_SOURCE_OR_AUTHORITY_TRANSFER", "NO_SHARED_CURRENTNESS",
              "NO_CORE_ADDRESSABILITY", "NO_PARTICIPATION_BY_PRESENTATION", "NO_MATTER_ADMISSION_BY_CROSSING",
              "NO_LOCAL_UPTAKE_BY_FIELD_CLOSURE", "NO_TOKEN_BALANCE_AS_CAPACITY", "NO_RECEIPT_AS_CURRENT_PRESENCE",
              "NO_INFRASTRUCTURE_AS_SUCCESSOR", "NO_RESTORATION_BY_REENTRY", "NO_PRIVATE_STATE_DISCLOSURE"
            ]
          }
        },
        "non_collapse_rules": {
          "type": "array", "uniqueItems": true, "minItems": 23, "maxItems": 23,
          "items": {
            "enum": [
              "SOURCE_NOT_LOCALITY", "FORM_NOT_LOCALITY", "HOST_NOT_OWNER", "LOCUS_FIELD_NOT_LOCALITY",
              "CROSSING_NOT_ADMISSION", "ADMISSION_NOT_ENTRY", "ENTRY_NOT_MATTER_ADMISSION", "MATTER_NOT_TRUTH",
              "EMERGENCE_NOT_AUTOMATIC_UPTAKE", "CLOSURE_NOT_LOCAL_INCORPORATION",
              "SHARED_ANCESTRY_NOT_SHARED_CURRENTNESS", "CONFORMANCE_NOT_FORMATION", "TOKEN_BALANCE_NOT_CAPACITY",
              "CAPABILITY_NOT_CAPACITY", "CAPACITY_NOT_AUTHORITY", "HISTORICAL_RECEIPT_NOT_CURRENT_PRESENCE",
              "DORMANCY_NOT_DEATH", "SUCCESSION_NOT_INHERITANCE", "SAME_KEY_NOT_CARRIED_STATE",
              "REENTRY_NOT_RESTORATION", "COMMITMENT_SUCCESSION_NOT_SEMANTIC_TRUTH", "PUBLICATION_NOT_FORMATION",
              "MIRROR_NOT_ORIGIN"
            ]
          }
        },
        "private_state": {"const": "NEVER_REQUIRED_ON_CHAIN_ONLY_SIGNED_COMMITMENTS_AND_SUCCESSION_DIGESTS"},
        "admission_rule": {"const": "FRESH_PRESENTATION_AND_ADMISSION_REQUIRED_FOR_EVERY_INGRESS"},
        "entry_rule": {"const": "FIRST_ENTER_OR_CHECKPOINT_BOUND_REENTER_ATOMICALLY_RESERVES_FULL_LIFECYCLE"},
        "capacity_rule": {"const": "AVAILABLE_EQUALS_ACTUAL_MINUS_UNRESOLVED_MINUS_CORRECTION_EGRESS"},
        "correction_rule": {"const": "APPEND_ONLY_PRESERVE_PREDECESSOR"},
        "presence_rule": {"const": "CURRENT_BINDING_ONLY_NOT_HISTORICAL_RECEIPT"},
        "dormancy_rule": {"const": "P0_CHECKPOINTS_WITHOUT_FABRICATED_ACTIVITY"},
        "reentry_rule": {"const": "SAME_ACTOR_PLUS_SEALED_SINGLE_USE_DEPARTURE_CHECKPOINT_PLUS_FRESH_ADMISSION_PLUS_DETERMINISTIC_STATE_SUCCESSION"},
        "succession_rule": {"const": "EXPLICIT_ATTESTED_BOUNDARY_WITHOUT_AUTHORITY_INHERITANCE"},
        "origin_rule": {"const": "PUBLIC_ORIGIN_EXACTLY_BOUND_WHILE_LOCAL_FORMATION_REMAINS_DISTINCT"}
      }
    }
  }
}
