{
  "format": "PRESENCE_AVALANCHE_RUNTIME_GENESIS_001",
  "version": 1,
  "encoding": "UTF-8_JSON",
  "domain": {
    "id": "PRESENCE_AVALANCHE_VM_001",
    "genesis_id": "",
    "vm_class": "AVALANCHE_CUSTOM_RPCCHAINVM",
    "execution_model": "NON_EVM_SIGNED_EVENT_SOURCED",
    "state_model": "VERSIONED_EVENT_SOURCED_LIVING_CAPACITY",
    "purpose": ""
  },
  "lineage": {
    "direct_predecessor": {
      "protocol": "LOCALITY_VM_003",
      "version": "3.0.0",
      "vm_id": "25tZjky6SecZA1Gwc6VwD2ouy64xAUdgNLo1C8dkXfbsFNxaTk",
      "repository_pack_sha256": "5597eab61802b1df92636b6df88fea46b88f460c4e5f2c51e393c5c6ce7a214f",
      "repository_checksum_sidecar_sha256": "abab31f2dd1018831034bc93e67eb7e125352e1fb71142e8ed6e5bafa4235e69",
      "linux_release_sha256": "205d6823e520884c59fb09f06091362370c29891661e54af7aff0f313c6bbb65",
      "qualification_evidence_sha256": "170eafe5836ee5d43bd0def635c048a29d9b30937e596a4336378695500aac64",
      "disposition": "PRESERVED_IMMUTABLE_PREDECESSOR"
    },
    "formation_ancestor": {
      "name": "KENTRA",
      "blockchain_id": "LB6wwV4JNxr8fwjUPBHMzf3PiW2d4hsTc4v63uX1MjY6oZ9Wb",
      "l1_id": "21mJfY4QpDeVykBaeG8nwn7k7w7b5oPpPhaYcJWqumht8SvaK",
      "vm_id": "pJHx1NU8ghWsiwg1vrqwaqE5uKh1k4EJRBkpB1tKV1QuQFhMi",
      "validation_id": "ttR2sBgWUEq3e6dupCxYcyiGTv49wnYW3wZ6TUs7XnDkTeZjh",
      "validator_node_id": "NodeID-AD66psMnQ257UAF7Jz9FmNAyRdibVnkt",
      "genesis_id": "KENTRA-CUSTOM-VM-GENESIS-001",
      "body_sha256": "58bf3daa9c74aac496451179f053152ed50943b8e8c4dbdac8f34d7172ab4f72",
      "disposition": "FORMATION_COMPLETE_REFERENCE_ONLY",
      "credential_custody": "UNAVAILABLE_TO_CURRENT_OPERATOR",
      "continuation_requirement": "NEW_LOCALITY_REQUIRES_NEW_VALIDATOR_AND_AUTHORITY_CUSTODY"
    },
    "relation": "SUCCESSOR_DERIVED_WITHOUT_REWRITE",
    "effect": "ANCESTRY_REFERENCE_ONLY",
    "authority_transfer": "NONE",
    "shared_currentness": "NONE"
  },
  "constitution": {
    "human_path": "SOURCE/CONSTITUTION_0()1.md",
    "human_sha256": "affeb5738cdfeea7ee4fe985652bf78b15eb6dfbba5871d82f0f2213a81832d0",
    "machine_path": "SOURCE/CONSTITUTION_0()1.json",
    "machine_sha256": "519a81d2a26d5bf32afd77566bbb35b4d28b22af85ac45a7055fccd1b45222f8",
    "form_binding_path": "SYSTEM/AVALANCHE/AVALANCHE_IMPLEMENTATION_001/bindings/SOURCE_STATE_BINDING_001.json",
    "form_binding_sha256": "8d96c1e24262164636c8068292ccef0d20029488568cc805b6097e3430eb9842",
    "form_binding_bytes": 1456,
    "public_origin": {
      "repository": "https://github.com/ia-mm-ai/PRESENCE",
      "commit": "5e09d1fbe3c1008937d95497fcc162a6ebd4190d",
      "human_repository_path": "SOURCE/CONSTITUTION_0()1.md",
      "machine_repository_path": "SOURCE/CONSTITUTION_0()1.json",
      "human_bytes": 44133,
      "machine_bytes": 146048,
      "binding": "SOURCE_AT_STARTING_COMMIT_WITH_SUCCESSOR_LOCAL_STATE_BINDING",
      "mirror_effect": "NO_BUNDLED_SOURCE_MIRROR",
      "publication_effect": "PUBLICATION_NOT_FORMATION"
    },
    "human_role": "SUBSTANTIVE_MEANING",
    "machine_role": "REPRESENTATION_ONLY",
    "conflict_result": "UNRESOLVED_HOLD_EXACT_SCOPE",
    "parsing_has_force": false
  },
  "locality": {
    "id": "",
    "source_reference": "",
    "source_sha256": "",
    "formation_authority": {
      "scheme": "ED25519",
      "key_id": "MATERIALIZE-WITH-PRESENCE-AVALANCHE-VM",
      "public_key": "",
      "scope": "FORMATION_AND_BOOTSTRAP_ONLY"
    }
  },
  "profile": {
    "form_id": "PRESENCE-AVALANCHE-FORM-001",
    "form_sha256": "e70fedb8ec8420275703542ee16d6d0429b1b5979b0b8ff964eac87aa19a7d8a",
    "gate_postures": ["ADMIT", "REFUSE", "WITHHOLD", "HOLD"],
    "effect_ceiling": [
      "NO_FORMATION_BY_CONFORMANCE",
      "NO_SOURCE_OR_AUTHORITY_TRANSFER",
      "NO_SHARED_CURRENTNESS",
      "NO_CORE_ADDRESSABILITY",
      "NO_PARTICIPATION_BY_PRESENTATION",
      "NO_MATTER_ADMISSION_BY_CROSSING",
      "NO_LOCAL_UPTAKE_BY_FIELD_CLOSURE",
      "NO_TOKEN_BALANCE_AS_CAPACITY",
      "NO_RECEIPT_AS_CURRENT_PRESENCE",
      "NO_INFRASTRUCTURE_AS_SUCCESSOR",
      "NO_RESTORATION_BY_REENTRY",
      "NO_PRIVATE_STATE_DISCLOSURE"
    ],
    "non_collapse_rules": [
      "SOURCE_NOT_LOCALITY",
      "FORM_NOT_LOCALITY",
      "HOST_NOT_OWNER",
      "LOCUS_FIELD_NOT_LOCALITY",
      "CROSSING_NOT_ADMISSION",
      "ADMISSION_NOT_ENTRY",
      "ENTRY_NOT_MATTER_ADMISSION",
      "MATTER_NOT_TRUTH",
      "EMERGENCE_NOT_AUTOMATIC_UPTAKE",
      "CLOSURE_NOT_LOCAL_INCORPORATION",
      "SHARED_ANCESTRY_NOT_SHARED_CURRENTNESS",
      "CONFORMANCE_NOT_FORMATION",
      "TOKEN_BALANCE_NOT_CAPACITY",
      "CAPABILITY_NOT_CAPACITY",
      "CAPACITY_NOT_AUTHORITY",
      "HISTORICAL_RECEIPT_NOT_CURRENT_PRESENCE",
      "DORMANCY_NOT_DEATH",
      "SUCCESSION_NOT_INHERITANCE",
      "SAME_KEY_NOT_CARRIED_STATE",
      "REENTRY_NOT_RESTORATION",
      "COMMITMENT_SUCCESSION_NOT_SEMANTIC_TRUTH",
      "PUBLICATION_NOT_FORMATION",
      "MIRROR_NOT_ORIGIN"
    ],
    "private_state": "NEVER_REQUIRED_ON_CHAIN_ONLY_SIGNED_COMMITMENTS_AND_SUCCESSION_DIGESTS",
    "admission_rule": "FRESH_PRESENTATION_AND_ADMISSION_REQUIRED_FOR_EVERY_INGRESS",
    "entry_rule": "FIRST_ENTER_OR_CHECKPOINT_BOUND_REENTER_ATOMICALLY_RESERVES_FULL_LIFECYCLE",
    "capacity_rule": "AVAILABLE_EQUALS_ACTUAL_MINUS_UNRESOLVED_MINUS_CORRECTION_EGRESS",
    "correction_rule": "APPEND_ONLY_PRESERVE_PREDECESSOR",
    "presence_rule": "CURRENT_BINDING_ONLY_NOT_HISTORICAL_RECEIPT",
    "dormancy_rule": "P0_CHECKPOINTS_WITHOUT_FABRICATED_ACTIVITY",
    "reentry_rule": "SAME_ACTOR_PLUS_SEALED_SINGLE_USE_DEPARTURE_CHECKPOINT_PLUS_FRESH_ADMISSION_PLUS_DETERMINISTIC_STATE_SUCCESSION",
    "succession_rule": "EXPLICIT_ATTESTED_BOUNDARY_WITHOUT_AUTHORITY_INHERITANCE",
    "origin_rule": "PUBLIC_ORIGIN_EXACTLY_BOUND_WHILE_LOCAL_FORMATION_REMAINS_DISTINCT"
  },
  "capacity": {
    "unit": "PRESENCE_AVALANCHE_CAPACITY_UNIT",
    "structural_ceiling_units": 1000,
    "initial_actual_units": 1000,
    "correction_egress_reserve_units": 100,
    "max_admission_offer_seconds": 86400,
    "availability_rule": "C_AVAILABLE_EQUALS_C_ACTUAL_MINUS_C_UNRESOLVED_MINUS_C_CORRECTION_EGRESS",
    "reservation_rule": "ENTER_RESERVES_WORK_AND_LAWFUL_RESOLUTION_ATOMICALLY",
    "degradation_rule": "INSUFFICIENT_ACTUAL_CAPACITY_FORCES_HOLD_WITH_CORRECTION_AND_EGRESS_OPEN"
  },
  "continuity": {
    "initial_posture": "DORMANT_P0",
    "minimum_continuity_authorities": 2,
    "successor_attestation_threshold": 2,
    "formation_authority_lifecycle": "EXPLICITLY_EXHAUSTIBLE_AFTER_CONTINUITY_SEEDING",
    "p_zero_rule": "CHECKPOINT_DORMANT_NO_FABRICATED_ACTIVITY_REENTRY_OPEN",
    "pulse_rule": "SIGNED_CURRENTNESS_OBSERVATION_NOT_AUTONOMOUS_AUTHORITY",
    "infrastructure_succession_rule": "INFRASTRUCTURE_CANNOT_SELF_APPOINT_SUCCESSOR"
  },
  "initial_state": {
    "revision": 0,
    "previous_state_commitment": null,
    "history": "APPEND_ONLY"
  },
  "claim_limits": {
    "external_truth": "NOT_INFERRED",
    "receipt": "HISTORICAL_EVIDENCE_NOT_CURRENT_PRESENCE",
    "acceptance": "NOT_INFERRED",
    "consent": "NOT_INFERRED",
    "relation": "NOT_CREATED_BY_GENESIS",
    "crossing": "NOT_CREATED_BY_GENESIS",
    "capacity": "SIGNED_LOCAL_ACCOUNT_NOT_EXTERNAL_RESOURCE_PROOF",
    "pulse": "SIGNED_LOCAL_CURRENTNESS_NOT_EXTERNAL_LIVENESS_PROOF",
    "state_succession": "DETERMINISTIC_COMMITMENT_LINEAGE_NOT_SEMANTIC_TRUTH_OR_CONSCIOUSNESS_PROOF",
    "unknown": "REMAINS_UNKNOWN"
  },
  "evolution": {
    "state_schema_version": 1,
    "unknown_fields": "REJECT",
    "genesis_mutability": "IMMUTABLE",
    "upgrade_policy": "ATTESTED_SUCCESSOR_FREEZE_AND_EXTERNAL_BINARY_HANDOFF",
    "activation_effect": "FREEZES_PREDECESSOR_STATE_WITHOUT_EXECUTING_UNKNOWN_SUCCESSOR_CODE"
  }
}
